{
  "schema_version": 1,
  "current_session_id": null,
  "sessions": {},
  "compaction_state": {
    "last_compaction_at": null,
    "compaction_count": 0,
    "post_compact_recovery_needed": false,
    "recovery_reason": null,
    "recovery_detected_at": null,
    "post_compact_recovered_at": null,
    "last_injected_rules_hash": null,
    "recovery_events": []
  },
  "metadata": {
    "description": "LazyTrae Session tracking — mirrors LazyCodex session-state-lock.ts behavior. Tracks active sessions, compaction state, and session-level state for cross-session continuation.",
    "lock_mechanism": "File-based mutation lock (mkdir-based, 20 retries, 5ms delay). Mirrors LazyCodex withSessionStateLock pattern from lazycodex/plugins/omo/components/rules/src/session-state-lock.ts."
  },
  "_schema": "See .lazytraework/schemas/ for validation rules.",
  "_example": {
    "current_session_id": "trae:session-abc123",
    "sessions": {
      "trae:session-abc123": {
        "session_id": "trae:session-abc123",
        "started_at": "2026-07-09T09:00:00Z",
        "last_active_at": "2026-07-09T11:30:00Z",
        "status": "active",
        "active_plan": ".omo/plans/sample-plan.md",
        "work_id": "work-001",
        "agent": "sisyphus",
        "mode": "ultrawork"
      }
    }
  }
}
